{
  "classificacao_contas": {
    "amostra_classificacoes": [
      {
        "codigo": "1.1.1",
        "confianca": "alta",
        "conta": "Caixa",
        "grupo_atribuido": "caixa",
        "grupo_original": "caixa",
        "observacao": "Grupo informado no arquivo de entrada.",
        "origem_classificacao": "arquivo"
      },
      {
        "codigo": "1.1.2",
        "confianca": "alta",
        "conta": "Banco Conta Movimento",
        "grupo_atribuido": "bancos",
        "grupo_original": "bancos",
        "observacao": "Grupo informado no arquivo; mapa/inferencia sugeriu 'clientes'.",
        "origem_classificacao": "arquivo"
      },
      {
        "codigo": "1.1.3",
        "confianca": "alta",
        "conta": "Aplicacoes Financeiras",
        "grupo_atribuido": "bancos",
        "grupo_original": "bancos",
        "observacao": "Grupo informado no arquivo de entrada.",
        "origem_classificacao": "arquivo"
      },
      {
        "codigo": "1.2.1",
        "confianca": "alta",
        "conta": "Clientes a Receber",
        "grupo_atribuido": "clientes",
        "grupo_original": "clientes",
        "observacao": "Grupo informado no arquivo de entrada.",
        "origem_classificacao": "arquivo"
      },
      {
        "codigo": "1.2.2",
        "confianca": "alta",
        "conta": "Adiantamento a Socios",
        "grupo_atribuido": "socios",
        "grupo_original": "socios",
        "observacao": "Grupo informado no arquivo de entrada.",
        "origem_classificacao": "arquivo"
      },
      {
        "codigo": "2.1.1",
        "confianca": "alta",
        "conta": "Simples Nacional a Recolher",
        "grupo_atribuido": "tributos",
        "grupo_original": "tributos",
        "observacao": "Grupo informado no arquivo; mapa/inferencia sugeriu 'tributos_a_recolher'.",
        "origem_classificacao": "arquivo"
      },
      {
        "codigo": "2.1.2",
        "confianca": "alta",
        "conta": "INSS a Recolher",
        "grupo_atribuido": "tributos",
        "grupo_original": "tributos",
        "observacao": "Grupo informado no arquivo; mapa/inferencia sugeriu 'tributos_a_recolher'.",
        "origem_classificacao": "arquivo"
      },
      {
        "codigo": "2.1.3",
        "confianca": "alta",
        "conta": "ISS Retido ou a Recolher",
        "grupo_atribuido": "tributos",
        "grupo_original": "tributos",
        "observacao": "Grupo informado no arquivo; mapa/inferencia sugeriu 'fornecedores'.",
        "origem_classificacao": "arquivo"
      },
      {
        "codigo": "2.2.1",
        "confianca": "alta",
        "conta": "Emprestimos de Socios",
        "grupo_atribuido": "socios",
        "grupo_original": "socios",
        "observacao": "Grupo informado no arquivo de entrada.",
        "origem_classificacao": "arquivo"
      },
      {
        "codigo": "3.1.1",
        "confianca": "alta",
        "conta": "Receita de Servicos",
        "grupo_atribuido": "receita",
        "grupo_original": "receita",
        "observacao": "Grupo informado no arquivo de entrada.",
        "origem_classificacao": "arquivo"
      },
      {
        "codigo": "3.1.2",
        "confianca": "alta",
        "conta": "Receita de Servicos com Retencao",
        "grupo_atribuido": "receita",
        "grupo_original": "receita",
        "observacao": "Grupo informado no arquivo; mapa/inferencia sugeriu 'tributos_sobre_receita'.",
        "origem_classificacao": "arquivo"
      },
      {
        "codigo": "4.1.1",
        "confianca": "alta",
        "conta": "Pro Labore",
        "grupo_atribuido": "folha",
        "grupo_original": "folha",
        "observacao": "Grupo informado no arquivo; mapa/inferencia sugeriu 'custos'.",
        "origem_classificacao": "arquivo"
      },
      {
        "codigo": "4.1.2",
        "confianca": "alta",
        "conta": "Salarios",
        "grupo_atribuido": "folha",
        "grupo_original": "folha",
        "observacao": "Grupo informado no arquivo; mapa/inferencia sugeriu 'custos'.",
        "origem_classificacao": "arquivo"
      },
      {
        "codigo": "4.1.3",
        "confianca": "alta",
        "conta": "Encargos sobre Folha",
        "grupo_atribuido": "folha",
        "grupo_original": "folha",
        "observacao": "Grupo informado no arquivo; mapa/inferencia sugeriu 'custos'.",
        "origem_classificacao": "arquivo"
      },
      {
        "codigo": "4.2.1",
        "confianca": "alta",
        "conta": "Aluguel",
        "grupo_atribuido": "despesas",
        "grupo_original": "despesas",
        "observacao": "Grupo informado no arquivo de entrada.",
        "origem_classificacao": "arquivo"
      },
      {
        "codigo": "4.2.2",
        "confianca": "alta",
        "conta": "Servicos de Terceiros",
        "grupo_atribuido": "despesas",
        "grupo_original": "despesas",
        "observacao": "Grupo informado no arquivo de entrada.",
        "origem_classificacao": "arquivo"
      },
      {
        "codigo": "4.2.3",
        "confianca": "alta",
        "conta": "Telefonia e Internet",
        "grupo_atribuido": "despesas",
        "grupo_original": "despesas",
        "observacao": "Grupo informado no arquivo de entrada.",
        "origem_classificacao": "arquivo"
      },
      {
        "codigo": "4.2.4",
        "confianca": "alta",
        "conta": "Viagens e Representacao",
        "grupo_atribuido": "despesas",
        "grupo_original": "despesas",
        "observacao": "Grupo informado no arquivo; mapa/inferencia sugeriu 'despesas_representacao'.",
        "origem_classificacao": "arquivo"
      },
      {
        "codigo": "4.2.5",
        "confianca": "alta",
        "conta": "Material de Escritorio",
        "grupo_atribuido": "despesas",
        "grupo_original": "despesas",
        "observacao": "Grupo informado no arquivo de entrada.",
        "origem_classificacao": "arquivo"
      },
      {
        "codigo": "5.1.1",
        "confianca": "alta",
        "conta": "Distribuicao de Lucros",
        "grupo_atribuido": "lucros",
        "grupo_original": "lucros",
        "observacao": "Grupo informado no arquivo de entrada.",
        "origem_classificacao": "arquivo"
      },
      {
        "codigo": "6.1.1",
        "confianca": "alta",
        "conta": "Resultado do Periodo",
        "grupo_atribuido": "resultado",
        "grupo_original": "resultado",
        "observacao": "Grupo informado no arquivo de entrada.",
        "origem_classificacao": "arquivo"
      }
    ],
    "classificacoes_por_confianca": {
      "alta": 21
    },
    "classificacoes_por_origem": {
      "arquivo": 21
    },
    "contas_revisao": [
      {
        "codigo": "1.1.2",
        "confianca": "alta",
        "conta": "Banco Conta Movimento",
        "grupo_atribuido": "bancos",
        "grupo_original": "bancos",
        "observacao": "Grupo informado no arquivo; mapa/inferencia sugeriu 'clientes'.",
        "origem_classificacao": "arquivo"
      },
      {
        "codigo": "2.1.1",
        "confianca": "alta",
        "conta": "Simples Nacional a Recolher",
        "grupo_atribuido": "tributos",
        "grupo_original": "tributos",
        "observacao": "Grupo informado no arquivo; mapa/inferencia sugeriu 'tributos_a_recolher'.",
        "origem_classificacao": "arquivo"
      },
      {
        "codigo": "2.1.2",
        "confianca": "alta",
        "conta": "INSS a Recolher",
        "grupo_atribuido": "tributos",
        "grupo_original": "tributos",
        "observacao": "Grupo informado no arquivo; mapa/inferencia sugeriu 'tributos_a_recolher'.",
        "origem_classificacao": "arquivo"
      },
      {
        "codigo": "2.1.3",
        "confianca": "alta",
        "conta": "ISS Retido ou a Recolher",
        "grupo_atribuido": "tributos",
        "grupo_original": "tributos",
        "observacao": "Grupo informado no arquivo; mapa/inferencia sugeriu 'fornecedores'.",
        "origem_classificacao": "arquivo"
      },
      {
        "codigo": "3.1.2",
        "confianca": "alta",
        "conta": "Receita de Servicos com Retencao",
        "grupo_atribuido": "receita",
        "grupo_original": "receita",
        "observacao": "Grupo informado no arquivo; mapa/inferencia sugeriu 'tributos_sobre_receita'.",
        "origem_classificacao": "arquivo"
      },
      {
        "codigo": "4.1.1",
        "confianca": "alta",
        "conta": "Pro Labore",
        "grupo_atribuido": "folha",
        "grupo_original": "folha",
        "observacao": "Grupo informado no arquivo; mapa/inferencia sugeriu 'custos'.",
        "origem_classificacao": "arquivo"
      },
      {
        "codigo": "4.1.2",
        "confianca": "alta",
        "conta": "Salarios",
        "grupo_atribuido": "folha",
        "grupo_original": "folha",
        "observacao": "Grupo informado no arquivo; mapa/inferencia sugeriu 'custos'.",
        "origem_classificacao": "arquivo"
      },
      {
        "codigo": "4.1.3",
        "confianca": "alta",
        "conta": "Encargos sobre Folha",
        "grupo_atribuido": "folha",
        "grupo_original": "folha",
        "observacao": "Grupo informado no arquivo; mapa/inferencia sugeriu 'custos'.",
        "origem_classificacao": "arquivo"
      },
      {
        "codigo": "4.2.4",
        "confianca": "alta",
        "conta": "Viagens e Representacao",
        "grupo_atribuido": "despesas",
        "grupo_original": "despesas",
        "observacao": "Grupo informado no arquivo; mapa/inferencia sugeriu 'despesas_representacao'.",
        "origem_classificacao": "arquivo"
      }
    ],
    "grupos_identificados": {
      "bancos": 2,
      "caixa": 1,
      "clientes": 1,
      "despesas": 5,
      "folha": 3,
      "lucros": 1,
      "receita": 2,
      "resultado": 1,
      "socios": 2,
      "tributos": 3
    },
    "limite_exibicao_contas": 50,
    "total_contas": 21,
    "total_contas_revisao": 9
  },
  "conclusao_tecnica": {
    "conclusao_sugerida": "adversa",